{
  "schemaVersion": 1,
  "id": "seed-weekly-rollup",
  "title": "多源进展 → 项目周报",
  "domain": "项目管理",
  "industry": "通用",
  "summary": "从任务系统、群聊记录、各人周报里抽进展，合成一份不重复、不遗漏的项目周报。",
  "pain": "各人写法不同，汇总的人花半天对齐口径，还经常漏掉风险。",
  "aiPattern": "抽取 + 归并生成",
  "injection": "每周五下午由项目经理触发，生成初稿后人工改",
  "inputs": "任务系统状态变更、周报文本、关键群聊摘要、里程碑计划",
  "outputs": "周报初稿：进展（按里程碑归并）、偏差、风险与求助、下周计划",
  "humanInLoop": "项目经理补充判断与对外表述口径",
  "proofMetric": "汇总耗时从 4 小时到 30 分钟；风险项遗漏率降到 5% 以下",
  "effort": "S",
  "metrics": [
    "周报篇幅压缩 40% 且信息不丢"
  ],
  "risks": [
    "群聊里的口头承诺被当成正式进展",
    "状态字段更新不及时导致结论失真"
  ],
  "tags": [
    "项目管理",
    "抽取 + 归并生成"
  ],
  "author": "",
  "org": "",
  "version": "0.1.0",
  "license": "CC-BY-4.0",
  "published": true,
  "featured": false,
  "createdAt": "2026-10-27T00:00:00.000Z",
  "updatedAt": "2026-10-27T00:00:00.000Z"
}
