{
  "schemaVersion": 1,
  "id": "seed-ticket-triage",
  "title": "工单文本 → 归因与分派",
  "domain": "售后",
  "industry": "通用",
  "summary": "把自由文本工单归到统一问题码，识别批量性问题，并按技能路由到正确的人。",
  "pain": "同一个问题被写成十种说法，派错组、重复排查，批量问题发现时已经铺开。",
  "aiPattern": "信息抽取 + 分类",
  "injection": "工单创建后实时跑，命中批量特征时升级到质量或产品",
  "inputs": "工单标题与描述、产品与批次信息、历史处理记录",
  "outputs": "标准问题码、置信度、疑似批量标记、建议分派组",
  "humanInLoop": "组长确认批量标记后才升级或召回",
  "proofMetric": "一次派对率从 62% 到 88%；批量问题平均发现时间从 21 天缩到 7 天",
  "effort": "M",
  "metrics": [
    "单张工单归类 8 分钟 → 30 秒",
    "返工率下降 30%"
  ],
  "risks": [
    "问题码体系本身不统一，得先规范化再谈识别",
    "新问题没有对应码时会被硬塞进旧类"
  ],
  "tags": [
    "售后",
    "信息抽取 + 分类"
  ],
  "author": "",
  "org": "",
  "version": "0.1.0",
  "license": "CC-BY-4.0",
  "published": true,
  "featured": true,
  "createdAt": "2026-10-27T00:00:00.000Z",
  "updatedAt": "2026-10-27T00:00:00.000Z"
}
