{
  "schemaVersion": 1,
  "id": "seed-policy-qa",
  "title": "制度文档 → 可追溯问答",
  "domain": "知识管理",
  "industry": "通用",
  "summary": "把制度、流程、操作手册做成问答，每个回答都带原文出处与生效版本。",
  "pain": "同一件事三个部门三种说法，新人只能一个个问，被问的人也不确定。",
  "aiPattern": "检索增强生成",
  "injection": "员工在对话里直接问，答不出时进「待补清单」而不是硬答",
  "inputs": "制度文件（PDF/Word）、流程说明、历史问答记录",
  "outputs": "答案 + 出处条款 + 版本与生效日期 + 不确定时的追问建议",
  "humanInLoop": "制度归口部门审核答案；冲突条款由人决定以哪份为准",
  "proofMetric": "重复提问下降 50%；答案可追溯率 100%",
  "effort": "M",
  "metrics": [
    "新人独立上手时间从 6 周降到 3 周"
  ],
  "risks": [
    "旧版本文件混入知识库导致答错",
    "跨文档冲突时模型会自己选一个"
  ],
  "tags": [
    "知识管理",
    "检索增强生成"
  ],
  "author": "",
  "org": "",
  "version": "0.1.0",
  "license": "CC-BY-4.0",
  "published": true,
  "featured": false,
  "createdAt": "2026-10-27T00:00:00.000Z",
  "updatedAt": "2026-10-27T00:00:00.000Z"
}
