{
  "schemaVersion": 1,
  "id": "seed-tender-extract",
  "title": "招投标文件 → 要点与响应清单",
  "domain": "销售",
  "industry": "通用",
  "summary": "把招标文件里的资格要求、技术参数、评分办法、废标条款抽成可逐条核对的响应清单。",
  "pain": "标书上百页，漏读一条废标条款就白投；不同人读出来的重点还不一样。",
  "aiPattern": "检索增强 + 抽取",
  "injection": "拿到招标文件当天，售前先跑一遍出响应清单",
  "inputs": "招标文件（PDF）、历史投标模板、公司资质库",
  "outputs": "逐条响应清单（要求/我方是否满足/证据材料/负责人）+ 废标风险项",
  "humanInLoop": "售前与商务逐条确认「是否满足」，机器不做承诺",
  "proofMetric": "漏读条款导致的废标从每季 2 次到 0；标书准备时间缩短 30%",
  "effort": "M",
  "metrics": [
    "首次通读 6 小时 → 1 小时"
  ],
  "risks": [
    "澄清/补遗文件未同步导致版本错",
    "模型会把「原则上满足」读成「满足」"
  ],
  "tags": [
    "销售",
    "检索增强 + 抽取"
  ],
  "author": "",
  "org": "",
  "version": "0.1.0",
  "license": "CC-BY-4.0",
  "published": true,
  "featured": false,
  "createdAt": "2026-10-27T00:00:00.000Z",
  "updatedAt": "2026-10-27T00:00:00.000Z"
}
