{
  "schemaVersion": 1,
  "id": "seed-contract-clause-review",
  "title": "合同文本 → 风险条款审查",
  "domain": "法务",
  "industry": "通用",
  "summary": "用内部条款口径比对对方合同，标出偏离项、缺失项与高风险表述，并给修改建议。",
  "pain": "每份合同几十页，法务只能挑重点看，踩过的坑换个说法又会再踩一次。",
  "aiPattern": "检索增强 + 抽取比对",
  "injection": "业务方提交合同评审时，先跑机器初审再进法务",
  "inputs": "待审合同、标准条款库、历史争议案例",
  "outputs": "逐条风险标注（偏离/缺失/高风险）、对应标准条款、修改建议、必须人工确认项",
  "humanInLoop": "法务对高风险项逐条确认；机器意见不代替法务意见",
  "proofMetric": "初审覆盖条款数从 30% 到 100%；同类条款争议年度减少 50%",
  "effort": "M",
  "metrics": [
    "单份合同初审 3 小时 → 40 分钟"
  ],
  "risks": [
    "标准条款库不全会漏判",
    "法律措辞的细微差别模型不敏感，必须同时给原文"
  ],
  "tags": [
    "法务",
    "检索增强 + 抽取比对"
  ],
  "author": "",
  "org": "",
  "version": "0.1.0",
  "license": "CC-BY-4.0",
  "published": true,
  "featured": false,
  "createdAt": "2026-10-27T00:00:00.000Z",
  "updatedAt": "2026-10-27T00:00:00.000Z"
}
