{
  "schemaVersion": 1,
  "id": "seed-meeting-actions",
  "title": "会议录音 → 行动项工单",
  "domain": "协同办公",
  "industry": "通用",
  "summary": "把一次会议的录音整理成带责任人、截止时间和原文出处的行动项，直接进任务系统。",
  "pain": "会议靠人记，行动项散在聊天记录里，两周后无人认领。",
  "aiPattern": "信息抽取 + 生成",
  "injection": "会议结束后 10 分钟内，由会议召集人或助理把录音拖进来",
  "inputs": "会议录音、参会名单、上期行动项清单",
  "outputs": "行动项表：事项 / 责任人 / 截止日 / 依赖方 / 原文时间戳",
  "humanInLoop": "召集人逐条确认责任人与截止时间后才下发",
  "proofMetric": "行动项认领率从 60% 提到 95%，会后 24 小时内下发率 100%",
  "effort": "S",
  "metrics": [
    "2 小时会议 → 15 分钟出纪要",
    "行动项遗漏率下降 70%"
  ],
  "risks": [
    "多人抢话时说话人区分不准",
    "专业名词与缩写的转写错误会传到行动项"
  ],
  "tags": [
    "协同办公",
    "信息抽取 + 生成"
  ],
  "author": "",
  "org": "",
  "version": "0.1.0",
  "license": "CC-BY-4.0",
  "published": true,
  "featured": true,
  "createdAt": "2026-10-27T00:00:00.000Z",
  "updatedAt": "2026-10-27T00:00:00.000Z"
}
