{
  "schemaVersion": 1,
  "id": "seed-voice-of-customer",
  "title": "客户反馈 → 议题聚类与优先级",
  "domain": "客户服务",
  "industry": "通用",
  "summary": "把客服对话、评价、问卷开放题归到统一议题，按频次与影响排出改进优先级。",
  "pain": "反馈散在电话、聊天、问卷三处，谁叫得响就改谁，改完不知道有没有用。",
  "aiPattern": "分类 + 聚类",
  "injection": "每周一自动跑，产出议题榜与本周升温项",
  "inputs": "客服对话记录、评价文本、问卷开放题、投诉原因",
  "outputs": "议题榜（频次/影响/涉及产品线）、原文样本、升温告警",
  "humanInLoop": "服务负责人确认议题归类与优先级",
  "proofMetric": "Top3 议题月度闭环率 100%；同类投诉占比季度下降 20%",
  "effort": "M",
  "metrics": [
    "人工读反馈 16 小时/周 → 2 小时/周"
  ],
  "risks": [
    "反讽与方言导致情绪误判",
    "议题粒度过细会碎成上百类"
  ],
  "tags": [
    "客户服务",
    "分类 + 聚类"
  ],
  "author": "",
  "org": "",
  "version": "0.1.0",
  "license": "CC-BY-4.0",
  "published": true,
  "featured": false,
  "createdAt": "2026-10-27T00:00:00.000Z",
  "updatedAt": "2026-10-27T00:00:00.000Z"
}
