{
  "schemaVersion": 1,
  "id": "seed-invoice-entry",
  "title": "发票与报销单据 → 结构化录入",
  "domain": "财务",
  "industry": "通用",
  "summary": "拍照或扫描的发票、行程单、收据自动抽成报销明细，并对齐公司费用科目。",
  "pain": "月底报销堆积，财务逐张录入，科目选错还要退回重填。",
  "aiPattern": "多模态抽取 + 规则校验",
  "injection": "员工在报销系统提交附件时即时识别并预填",
  "inputs": "发票/收据图片、出差申请单、费用制度与科目表",
  "outputs": "结构化明细（金额/税额/日期/商户/项目）+ 建议科目 + 合规校验结果",
  "humanInLoop": "员工确认后再提交；金额与税号异常强制人工核对",
  "proofMetric": "单据录入时间从 90 秒到 12 秒；科目错误退回率从 25% 降到 5%",
  "effort": "S",
  "metrics": [
    "月度报销处理 4 人天 → 1 人天"
  ],
  "risks": [
    "模糊或折痕图片识别错误",
    "重复报销要靠系统侧规则，不能指望模型"
  ],
  "tags": [
    "财务",
    "多模态抽取 + 规则校验"
  ],
  "author": "",
  "org": "",
  "version": "0.1.0",
  "license": "CC-BY-4.0",
  "published": true,
  "featured": false,
  "createdAt": "2026-10-27T00:00:00.000Z",
  "updatedAt": "2026-10-27T00:00:00.000Z"
}
